{
  "artifact": "texture-table2-convergence-pilot",
  "canonical": false,
  "curves": [
    {
      "aggregate_steps_per_second": 39.96037172560277,
      "budget_steps": 10,
      "complete": true,
      "expected_trajectory_count": 6,
      "interval_train_seconds": 1.5014875340000344,
      "method": "LPE",
      "psnr_mean": 7.633577116068519,
      "psnr_stddev": 2.5770053740701573,
      "semantic_psnr_mean": {
        "AO": 1.3738012791207466,
        "ARM": 6.648704715742126,
        "DIFF": 6.907077913093808,
        "Displacement": 4.576671551034821,
        "metal": 10.034720533471845,
        "normal": 4.155610705126491,
        "rough": 6.7315310599523706,
        "specular": 25.56006659294103
      },
      "ssim_mean": 0.1331813266246172,
      "ssim_stddev": 0.022387632545798373,
      "trajectory_count": 6
    },
    {
      "aggregate_steps_per_second": 60.95403469145612,
      "budget_steps": 10,
      "complete": true,
      "expected_trajectory_count": 6,
      "interval_train_seconds": 0.9843482930000391,
      "method": "BI-Grid",
      "psnr_mean": 7.7325920868229945,
      "psnr_stddev": 2.706864143665191,
      "semantic_psnr_mean": {
        "AO": 1.1834218523273259,
        "ARM": 6.580338836151334,
        "DIFF": 7.290467251727808,
        "Displacement": 4.622935057347926,
        "metal": 10.118633970437749,
        "normal": 4.375001321813278,
        "rough": 6.636108342601843,
        "specular": 25.49568889275477
      },
      "ssim_mean": 0.1703298974924514,
      "ssim_stddev": 0.06527023473306245,
      "trajectory_count": 6
    },
    {
      "aggregate_steps_per_second": 29.748040227368577,
      "budget_steps": 10,
      "complete": true,
      "expected_trajectory_count": 6,
      "interval_train_seconds": 2.0169395880001275,
      "method": "Grid-PinkPEPS4F",
      "psnr_mean": 7.751037970950423,
      "psnr_stddev": 2.669592372564881,
      "semantic_psnr_mean": {
        "AO": 1.3415706520207944,
        "ARM": 6.352638768768479,
        "DIFF": 7.7458934555137136,
        "Displacement": 4.398996627503106,
        "metal": 10.055178419372636,
        "normal": 4.368996912220687,
        "rough": 7.13039913863494,
        "specular": 24.928690277818784
      },
      "ssim_mean": 0.14817818267943544,
      "ssim_stddev": 0.03347896496118421,
      "trajectory_count": 6
    },
    {
      "aggregate_steps_per_second": 46.56775190306629,
      "budget_steps": 10,
      "complete": true,
      "expected_trajectory_count": 6,
      "interval_train_seconds": 1.2884452769997097,
      "method": "NTC_N",
      "psnr_mean": 7.6076294188802045,
      "psnr_stddev": 2.648685025958391,
      "semantic_psnr_mean": {
        "AO": 1.3432651011343448,
        "ARM": 6.226013004958996,
        "DIFF": 7.075206883644967,
        "Displacement": 4.535635915540973,
        "metal": 10.002086419684076,
        "normal": 4.281944707847093,
        "rough": 6.369441389868938,
        "specular": 25.542634704926666
      },
      "ssim_mean": 0.16398139554221416,
      "ssim_stddev": 0.04285785860615681,
      "trajectory_count": 6
    },
    {
      "aggregate_steps_per_second": 19.40595342133323,
      "budget_steps": 10,
      "complete": true,
      "expected_trajectory_count": 6,
      "interval_train_seconds": 3.091834690999576,
      "method": "NTC_PinkPEPS",
      "psnr_mean": 7.8163353273461675,
      "psnr_stddev": 2.5551151248251274,
      "semantic_psnr_mean": {
        "AO": 1.5558767949679522,
        "ARM": 6.224877492424845,
        "DIFF": 8.06410991174222,
        "Displacement": 4.745913306226451,
        "metal": 9.965370535054015,
        "normal": 4.511704988382404,
        "rough": 7.005171941496368,
        "specular": 24.288354350751998
      },
      "ssim_mean": 0.17790807251197596,
      "ssim_stddev": 0.04058639105709799,
      "trajectory_count": 6
    },
    {
      "aggregate_steps_per_second": 39.187297836981415,
      "budget_steps": 50,
      "complete": true,
      "expected_trajectory_count": 6,
      "interval_train_seconds": 6.12443350900071,
      "method": "LPE",
      "psnr_mean": 17.71746703119782,
      "psnr_stddev": 1.5714059600158075,
      "semantic_psnr_mean": {
        "AO": 19.64103504516486,
        "ARM": 19.253989792580295,
        "DIFF": 18.52526621189773,
        "Displacement": 15.48812494033492,
        "metal": 9.984243245663672,
        "normal": 16.177326799988474,
        "rough": 18.611106284574504,
        "specular": 25.60432693012901
      },
      "ssim_mean": 0.3382544489370452,
      "ssim_stddev": 0.08388072549390424,
      "trajectory_count": 6
    },
    {
      "aggregate_steps_per_second": 37.59988407441547,
      "budget_steps": 50,
      "complete": true,
      "expected_trajectory_count": 6,
      "interval_train_seconds": 6.382998403000556,
      "method": "BI-Grid",
      "psnr_mean": 17.903054282151825,
      "psnr_stddev": 1.6115802232368919,
      "semantic_psnr_mean": {
        "AO": 20.01416878095818,
        "ARM": 19.456381877509767,
        "DIFF": 18.798887499931055,
        "Displacement": 15.245750017188321,
        "metal": 10.056990183263782,
        "normal": 16.682595641822378,
        "rough": 18.542130233284528,
        "specular": 25.94041623461411
      },
      "ssim_mean": 0.32815955169498917,
      "ssim_stddev": 0.0975563219295629,
      "trajectory_count": 6
    },
    {
      "aggregate_steps_per_second": 29.849295507505836,
      "budget_steps": 50,
      "complete": true,
      "expected_trajectory_count": 6,
      "interval_train_seconds": 8.040390766999849,
      "method": "Grid-PinkPEPS4F",
      "psnr_mean": 18.300757287190553,
      "psnr_stddev": 1.4404030977395037,
      "semantic_psnr_mean": {
        "AO": 21.52552987384703,
        "ARM": 19.767574335624598,
        "DIFF": 18.758294241458866,
        "Displacement": 15.507582739257915,
        "metal": 10.02907449913985,
        "normal": 17.421552280156714,
        "rough": 19.214183267385422,
        "specular": 26.0866418761029
      },
      "ssim_mean": 0.3631701731847392,
      "ssim_stddev": 0.06119054593990672,
      "trajectory_count": 6
    },
    {
      "aggregate_steps_per_second": 32.57188373233161,
      "budget_steps": 50,
      "complete": true,
      "expected_trajectory_count": 6,
      "interval_train_seconds": 7.368318085999135,
      "method": "NTC_N",
      "psnr_mean": 18.0600135242286,
      "psnr_stddev": 1.54286528001615,
      "semantic_psnr_mean": {
        "AO": 20.118451342924594,
        "ARM": 19.86417393565563,
        "DIFF": 18.708163639924667,
        "Displacement": 15.743979969760323,
        "metal": 10.031492100417921,
        "normal": 16.976513776679823,
        "rough": 18.584728950302587,
        "specular": 25.80049253634319
      },
      "ssim_mean": 0.33005044621725876,
      "ssim_stddev": 0.0936787814006466,
      "trajectory_count": 6
    },
    {
      "aggregate_steps_per_second": 17.65642358807173,
      "budget_steps": 50,
      "complete": true,
      "expected_trajectory_count": 6,
      "interval_train_seconds": 13.59278671599941,
      "method": "NTC_PinkPEPS",
      "psnr_mean": 18.823354702555516,
      "psnr_stddev": 1.287366775502871,
      "semantic_psnr_mean": {
        "AO": 22.305844903444818,
        "ARM": 20.717046872628146,
        "DIFF": 19.187616224937045,
        "Displacement": 16.413189068576198,
        "metal": 10.183326585411473,
        "normal": 17.780245821328275,
        "rough": 19.80630053162344,
        "specular": 26.10759381435517
      },
      "ssim_mean": 0.38758555725216864,
      "ssim_stddev": 0.08280717927519653,
      "trajectory_count": 6
    },
    {
      "aggregate_steps_per_second": 64.85340807446254,
      "budget_steps": 200,
      "complete": true,
      "expected_trajectory_count": 6,
      "interval_train_seconds": 13.877451112000927,
      "method": "LPE",
      "psnr_mean": 23.549672273432876,
      "psnr_stddev": 3.052795897094851,
      "semantic_psnr_mean": {
        "AO": 25.711828310043217,
        "ARM": 27.50728952894279,
        "DIFF": 22.999421061738385,
        "Displacement": 28.49422285801028,
        "metal": 10.0548713079011,
        "normal": 18.509116614626638,
        "rough": 23.989651972620454,
        "specular": 29.035993294396224
      },
      "ssim_mean": 0.6777211942606503,
      "ssim_stddev": 0.12767333168740938,
      "trajectory_count": 6
    },
    {
      "aggregate_steps_per_second": 72.5547190489637,
      "budget_steps": 200,
      "complete": true,
      "expected_trajectory_count": 6,
      "interval_train_seconds": 12.404430914998557,
      "method": "BI-Grid",
      "psnr_mean": 26.16935830142583,
      "psnr_stddev": 2.588166210981353,
      "semantic_psnr_mean": {
        "AO": 26.84984549089589,
        "ARM": 28.203701188481208,
        "DIFF": 25.385847474363,
        "Displacement": 29.872979536780818,
        "metal": 18.181914302167105,
        "normal": 20.185608783746034,
        "rough": 28.931712586724434,
        "specular": 32.65146509749865
      },
      "ssim_mean": 0.7455042978127797,
      "ssim_stddev": 0.1274445567324746,
      "trajectory_count": 6
    },
    {
      "aggregate_steps_per_second": 35.92338125742257,
      "budget_steps": 200,
      "complete": true,
      "expected_trajectory_count": 6,
      "interval_train_seconds": 25.053320943001154,
      "method": "Grid-PinkPEPS4F",
      "psnr_mean": 26.267966919227845,
      "psnr_stddev": 1.7023537589297084,
      "semantic_psnr_mean": {
        "AO": 26.57655100364919,
        "ARM": 27.674215109833558,
        "DIFF": 25.13170703313736,
        "Displacement": 30.58475082784881,
        "metal": 22.42062063979034,
        "normal": 20.142896207551107,
        "rough": 29.343936693373802,
        "specular": 30.0594593423636
      },
      "ssim_mean": 0.7347268591324488,
      "ssim_stddev": 0.09605899816080687,
      "trajectory_count": 6
    },
    {